[
  {
    "wikiId": "statistics:stat_action_total",
    "gameId": "STAT_ACTION_TOTAL",
    "kind": "statistics",
    "slug": "stat_action_total",
    "type": "StatisticDescription",
    "names": {
      "en": "Total Actions Performed",
      "ko": "액션 총 수행 수",
      "ja": "アクション総実行数",
      "es": "Acciones totales",
      "zh-Hans": "行动完成总次数",
      "zh-Hant": "行動完成總次數"
    },
    "descriptions": {
      "en": "Total number of life skill/action completions.",
      "ko": "생활/액션 수행 합계",
      "ja": "生活/アクション実行の合計",
      "es": "Total acciones/habilidades completadas.",
      "zh-Hans": "生活技能／行动的完成总次数。",
      "zh-Hant": "生活技能／行動的完成總次數。"
    },
    "image": null,
    "data": {
      "scope": "Save lifetime; no personal values are exported."
    },
    "relations": [],
    "aliases": []
  },
  {
    "wikiId": "statistics:stat_ammo_total",
    "gameId": "STAT_AMMO_TOTAL",
    "kind": "statistics",
    "slug": "stat_ammo_total",
    "type": "StatisticDescription",
    "names": {
      "en": "Ammo Consumed",
      "ko": "탄약 소모수",
      "ja": "弾薬消費数",
      "es": "Munición usada",
      "zh-Hans": "弹药消耗量",
      "zh-Hant": "彈藥消耗量"
    },
    "descriptions": {
      "en": "Number of ammo items consumed.",
      "ko": "탄약 아이템 소모 수",
      "ja": "弾薬アイテムの消費数",
      "es": "Munición consumida.",
      "zh-Hans": "消耗弹药数量。",
      "zh-Hant": "消耗彈藥數量。"
    },
    "image": null,
    "data": {
      "scope": "Save lifetime; no personal values are exported."
    },
    "relations": [],
    "aliases": []
  },
  {
    "wikiId": "statistics:stat_charm_total",
    "gameId": "STAT_CHARM_TOTAL",
    "kind": "statistics",
    "slug": "stat_charm_total",
    "type": "StatisticDescription",
    "names": {
      "en": "Charms Consumed",
      "ko": "부적 소모량",
      "ja": "お守り消費数",
      "es": "Talismanes usados",
      "zh-Hans": "护符消耗量",
      "zh-Hant": "護符消耗量"
    },
    "descriptions": {
      "en": "Number of charm items consumed.",
      "ko": "부적 아이템 소모 수",
      "ja": "お守りアイテムの消費数",
      "es": "Talismanes consumidos.",
      "zh-Hans": "消耗护符数量。",
      "zh-Hant": "消耗護符數量。"
    },
    "image": null,
    "data": {
      "scope": "Save lifetime; no personal values are exported."
    },
    "relations": [],
    "aliases": []
  },
  {
    "wikiId": "statistics:stat_dungeon_clear",
    "gameId": "STAT_DUNGEON_CLEAR",
    "kind": "statistics",
    "slug": "stat_dungeon_clear",
    "type": "StatisticDescription",
    "names": {
      "en": "Dungeon Clears",
      "ko": "던전 클리어",
      "ja": "ダンジョンクリア",
      "es": "Mazmorras",
      "zh-Hans": "地下城通关次数",
      "zh-Hant": "地下城通關次數"
    },
    "descriptions": {
      "en": "Number of dungeon clears.",
      "ko": "던전 클리어 횟수",
      "ja": "ダンジョンのクリア回数",
      "es": "Mazmorras completadas.",
      "zh-Hans": "地下城通关次数。",
      "zh-Hant": "地下城通關次數。"
    },
    "image": null,
    "data": {
      "scope": "Save lifetime; no personal values are exported."
    },
    "relations": [],
    "aliases": []
  },
  {
    "wikiId": "statistics:stat_food_total",
    "gameId": "STAT_FOOD_TOTAL",
    "kind": "statistics",
    "slug": "stat_food_total",
    "type": "StatisticDescription",
    "names": {
      "en": "Food Eaten",
      "ko": "음식 먹은 횟수",
      "ja": "食べ物を食べた回数",
      "es": "Comida consumida",
      "zh-Hans": "食物食用次数",
      "zh-Hant": "食物食用次數"
    },
    "descriptions": {
      "en": "Number of food items used.",
      "ko": "음식 사용 횟수",
      "ja": "食べ物の使用回数",
      "es": "Objetos de comida usados.",
      "zh-Hans": "食物使用次数。",
      "zh-Hant": "食物使用次數。"
    },
    "image": null,
    "data": {
      "scope": "Save lifetime; no personal values are exported."
    },
    "relations": [],
    "aliases": []
  },
  {
    "wikiId": "statistics:stat_forest_clear",
    "gameId": "STAT_FOREST_CLEAR",
    "kind": "statistics",
    "slug": "stat_forest_clear",
    "type": "StatisticDescription",
    "names": {
      "en": "Forest Area Clears",
      "ko": "숲 지역 클리어",
      "ja": "森地域クリア",
      "es": "Bosques",
      "zh-Hans": "森林区域通关次数",
      "zh-Hant": "森林區域通關次數"
    },
    "descriptions": {
      "en": "Number of forest area clears.",
      "ko": "숲 지역 클리어 횟수",
      "ja": "森地域のクリア回数",
      "es": "Bosques completados.",
      "zh-Hans": "森林区域的通关次数。",
      "zh-Hant": "森林區域的通關次數。"
    },
    "image": null,
    "data": {
      "scope": "Save lifetime; no personal values are exported."
    },
    "relations": [],
    "aliases": []
  },
  {
    "wikiId": "statistics:stat_item_kind_count",
    "gameId": "STAT_ITEM_KIND_COUNT",
    "kind": "statistics",
    "slug": "stat_item_kind_count",
    "type": "StatisticDescription",
    "names": {
      "en": "Obtained Item Kinds",
      "ko": "획득한 아이템 가짓수",
      "ja": "獲得アイテム種類数",
      "es": "Tipos de objeto",
      "zh-Hans": "已获得物品种类",
      "zh-Hant": "已取得物品種類"
    },
    "descriptions": {
      "en": "Obtained item kinds / total item kinds.",
      "ko": "획득한 아이템 가짓수 / 전체 아이템 가짓수",
      "ja": "獲得したアイテム種類数 / 全アイテム種類数",
      "es": "Tipos obtenidos / total.",
      "zh-Hans": "已获得物品种类／物品总种类。",
      "zh-Hant": "已取得物品種類／物品總種類。"
    },
    "image": null,
    "data": {
      "scope": "Save lifetime; no personal values are exported."
    },
    "relations": [],
    "aliases": []
  },
  {
    "wikiId": "statistics:stat_lifetime_playtime",
    "gameId": "STAT_LIFETIME_PLAYTIME",
    "kind": "statistics",
    "slug": "stat_lifetime_playtime",
    "type": "StatisticDescription",
    "names": {
      "en": "Lifetime Playtime",
      "ko": "누적 접속시간",
      "ja": "累積プレイ時間",
      "es": "Tiempo total",
      "zh-Hans": "累计游玩时间",
      "zh-Hant": "累計遊玩時間"
    },
    "descriptions": {
      "en": "Total play time since this save first started.",
      "ko": "게임을 처음 시작한 뒤 누적된 전체 플레이 시간",
      "ja": "このセーブを開始してからの累積プレイ時間",
      "es": "Tiempo jugado desde crear este guardado.",
      "zh-Hans": "从建立此存档起累计的游玩时间。",
      "zh-Hant": "自建立此存檔起累計的遊玩時間。"
    },
    "image": null,
    "data": {
      "scope": "Save lifetime; no personal values are exported."
    },
    "relations": [],
    "aliases": []
  },
  {
    "wikiId": "statistics:stat_mine_clear",
    "gameId": "STAT_MINE_CLEAR",
    "kind": "statistics",
    "slug": "stat_mine_clear",
    "type": "StatisticDescription",
    "names": {
      "en": "Mining Area Clears",
      "ko": "채광 지역 클리어",
      "ja": "採掘地域クリア",
      "es": "Áreas mineras",
      "zh-Hans": "采矿区域通关次数",
      "zh-Hant": "採礦區域通關次數"
    },
    "descriptions": {
      "en": "Number of mining area clears.",
      "ko": "채광 지역 클리어 횟수",
      "ja": "採掘地域のクリア回数",
      "es": "Áreas mineras completadas.",
      "zh-Hans": "采矿区域的通关次数。",
      "zh-Hant": "採礦區域的通關次數。"
    },
    "image": null,
    "data": {
      "scope": "Save lifetime; no personal values are exported."
    },
    "relations": [],
    "aliases": []
  },
  {
    "wikiId": "statistics:stat_monster_kill_total",
    "gameId": "STAT_MONSTER_KILL_TOTAL",
    "kind": "statistics",
    "slug": "stat_monster_kill_total",
    "type": "StatisticDescription",
    "names": {
      "en": "Monsters Defeated",
      "ko": "몬스터 처치수",
      "ja": "モンスター討伐数",
      "es": "Monstruos derrotados",
      "zh-Hans": "已击败怪物",
      "zh-Hant": "已擊敗怪物"
    },
    "descriptions": {
      "en": "Total number of monsters defeated.",
      "ko": "전체 몬스터 처치 수",
      "ja": "倒したモンスターの合計数",
      "es": "Monstruos derrotados en total.",
      "zh-Hans": "击败怪物总数。",
      "zh-Hant": "擊敗怪物總數。"
    },
    "image": null,
    "data": {
      "scope": "Save lifetime; no personal values are exported."
    },
    "relations": [],
    "aliases": []
  },
  {
    "wikiId": "statistics:stat_normal_clear",
    "gameId": "STAT_NORMAL_CLEAR",
    "kind": "statistics",
    "slug": "stat_normal_clear",
    "type": "StatisticDescription",
    "names": {
      "en": "Normal Area Clears",
      "ko": "일반 지역 클리어",
      "ja": "通常地域クリア",
      "es": "Áreas normales",
      "zh-Hans": "普通区域通关次数",
      "zh-Hant": "普通區域通關次數"
    },
    "descriptions": {
      "en": "Number of normal area clears.",
      "ko": "일반 지역 클리어 횟수",
      "ja": "通常地域のクリア回数",
      "es": "Completados de áreas normales.",
      "zh-Hans": "普通区域的通关次数。",
      "zh-Hant": "普通區域的通關次數。"
    },
    "image": null,
    "data": {
      "scope": "Save lifetime; no personal values are exported."
    },
    "relations": [],
    "aliases": []
  },
  {
    "wikiId": "statistics:stat_potion_total",
    "gameId": "STAT_POTION_TOTAL",
    "kind": "statistics",
    "slug": "stat_potion_total",
    "type": "StatisticDescription",
    "names": {
      "en": "Potions Drunk",
      "ko": "포션 마신 횟수",
      "ja": "ポーションを飲んだ回数",
      "es": "Pociones bebidas",
      "zh-Hans": "药水饮用次数",
      "zh-Hant": "藥水飲用次數"
    },
    "descriptions": {
      "en": "Number of potions activated.",
      "ko": "포션 발동 횟수",
      "ja": "ポーションの発動回数",
      "es": "Pociones activadas.",
      "zh-Hans": "药水使用次数。",
      "zh-Hant": "藥水使用次數。"
    },
    "image": null,
    "data": {
      "scope": "Save lifetime; no personal values are exported."
    },
    "relations": [],
    "aliases": []
  },
  {
    "wikiId": "statistics:stat_sea_clear",
    "gameId": "STAT_SEA_CLEAR",
    "kind": "statistics",
    "slug": "stat_sea_clear",
    "type": "StatisticDescription",
    "names": {
      "en": "Sea Area Clears",
      "ko": "바다 지역 클리어",
      "ja": "海地域クリア",
      "es": "Áreas marinas",
      "zh-Hans": "海洋区域通关次数",
      "zh-Hant": "海洋區域通關次數"
    },
    "descriptions": {
      "en": "Number of sea area clears.",
      "ko": "바다 지역 클리어 횟수",
      "ja": "海地域のクリア回数",
      "es": "Áreas marinas completadas.",
      "zh-Hans": "海洋区域的通关次数。",
      "zh-Hant": "海洋區域的通關次數。"